<?xml version="1.0"?>
<dataDocument xmlns:xsi="http://www.w3.org/2001/XMLSchema-instance" xsi:schemaLocation="example-25.xsd example-25.xsd">
    <engineType>
        <combustible id="US">
            <combustibleId>Gasoline</combustibleId>
        </combustible>
        <combustible id="UK">
            <combustibleId>Petrol</combustibleId>
        </combustible>
        <fuelSpecs>
            <combustibleref href="UK"/>
            <capacityUnitId>UK Gallon</capacityUnitId>
        </fuelSpecs>
        <fuelSpecs>
            <combustibleref href="US"/>
            <capacityUnitId>US Gallon</capacityUnitId>
        </fuelSpecs>
    </engineType>
</dataDocument>